{
  "$schema": "http://json-schema.org/draft-07/schema#",
  "$id": "https://sentinel-shield/schemas/release-manifest.schema.json",
  "title": "Sentinel Shield release manifest",
  "description": "A canonical, deterministically-serialized fingerprint of exactly WHAT a release ships: the source commit and its git tree hash, the tag target, the release scope, the CI workflow runs, the verified artifact digests, the workflow action pins, the tool versions, and the profile-policy and schema digests. The document is split into a hashed `body` (the reproducible content) and a NON-hashed `metadata` section (timestamps and tool-environment provenance that must NOT perturb the reproducibility hash). `reproducibility.hash` is the SHA-256 of the canonical serialization of `body` alone (jq -S -c, i.e. recursively key-sorted, compact); regenerating from the same repository state yields an identical hash, and any tamper to `body` is detected because the stored hash no longer matches. Contains NO secrets.",
  "type": "object",
  "additionalProperties": false,
  "required": ["schema_version", "metadata", "body", "reproducibility"],
  "properties": {
    "schema_version": { "type": "string", "const": "1" },
    "metadata": {
      "type": "object",
      "additionalProperties": false,
      "description": "NON-hashed provenance. Excluded from reproducibility.hash by construction so timestamps and tool-environment differences never change the reproducible fingerprint.",
      "required": ["generated_at", "generator"],
      "properties": {
        "generated_at": {
          "type": "string",
          "pattern": "^[0-9]{4}-[0-9]{2}-[0-9]{2}T[0-9]{2}:[0-9]{2}:[0-9]{2}([.][0-9]+)?Z$",
          "description": "ISO-8601 UTC time the manifest was generated. NOT hashed."
        },
        "generator": { "type": "string", "minLength": 1 }
      }
    },
    "body": {
      "type": "object",
      "additionalProperties": false,
      "description": "The reproducible content. reproducibility.hash covers exactly this object, canonicalized with jq -S -c.",
      "required": [
        "version",
        "stage",
        "release_scope",
        "source_commit",
        "tree_hash",
        "tag_target",
        "workflow_runs",
        "artifact_digests",
        "action_pins",
        "tool_versions",
        "profile_policy_digests",
        "schema_digests"
      ],
      "properties": {
        "version": { "type": "string", "minLength": 1 },
        "stage": { "type": "string", "enum": ["alpha", "beta", "rc", "ga"] },
        "release_scope": { "type": "string", "enum": ["engine-only", "framework-validated", "full-platform"] },
        "source_commit": { "type": "string", "pattern": "^([0-9a-f]{40}|unknown)$", "description": "The CI-validated release-source commit (engine_commit)." },
        "tree_hash": { "type": "string", "pattern": "^([0-9a-f]{40}|unknown)$", "description": "git tree hash of source_commit (rev-parse <commit>^{tree}); 'unknown' when not locally resolvable." },
        "tag_target": { "type": "string", "pattern": "^([0-9a-f]{40}|unknown)$", "description": "The commit the release tag points at (release_commit, or source_commit when they are the same)." },
        "workflow_runs": {
          "type": "array",
          "description": "The engine CI runs that back the release, sorted by run_id.",
          "items": {
            "type": "object",
            "additionalProperties": false,
            "required": ["workflow_name", "run_id", "commit", "result"],
            "properties": {
              "workflow_name": { "type": "string", "minLength": 1 },
              "run_id": { "oneOf": [ { "type": "integer", "minimum": 1 }, { "type": "string", "pattern": "^[1-9][0-9]*$" } ] },
              "commit": { "type": "string", "pattern": "^[0-9a-f]{40}$" },
              "result": { "type": "string", "enum": ["success", "failure", "cancelled", "skipped"] }
            }
          }
        },
        "artifact_digests": {
          "type": "array",
          "description": "SHA-256 digests of the verified release artifacts, sorted by (run_id, artifact_id).",
          "items": {
            "type": "object",
            "additionalProperties": false,
            "required": ["run_id", "artifact_id", "name", "sha256"],
            "properties": {
              "run_id": { "oneOf": [ { "type": "integer", "minimum": 1 }, { "type": "string", "pattern": "^[1-9][0-9]*$" } ] },
              "artifact_id": { "type": "integer", "minimum": 1 },
              "name": { "type": "string", "minLength": 1 },
              "sha256": { "type": "string", "pattern": "^[0-9a-f]{64}$" }
            }
          }
        },
        "action_pins": {
          "type": "array",
          "description": "Every workflow `uses:` reference (engine CI + consumer templates), de-duplicated and sorted, so a moved/mutated action pin changes the fingerprint.",
          "items": {
            "type": "object",
            "additionalProperties": false,
            "required": ["source", "uses"],
            "properties": {
              "source": { "type": "string", "minLength": 1, "description": "workflow file the reference was found in" },
              "uses": { "type": "string", "minLength": 1, "description": "the `uses:` ref token, e.g. owner/action@<sha>" }
            }
          }
        },
        "tool_versions": {
          "type": "object",
          "description": "Versions of the tools that produced the release. Part of the provenance fingerprint: a manifest built in a different tool environment is legitimately different.",
          "additionalProperties": { "type": "string" }
        },
        "profile_policy_digests": {
          "type": "array",
          "description": "SHA-256 of each shipped profile-policy manifest, sorted by path.",
          "items": {
            "type": "object",
            "additionalProperties": false,
            "required": ["path", "sha256"],
            "properties": {
              "path": { "type": "string", "minLength": 1 },
              "sha256": { "type": "string", "pattern": "^[0-9a-f]{64}$" }
            }
          }
        },
        "schema_digests": {
          "type": "array",
          "description": "SHA-256 of each shipped JSON schema, sorted by path.",
          "items": {
            "type": "object",
            "additionalProperties": false,
            "required": ["path", "sha256"],
            "properties": {
              "path": { "type": "string", "minLength": 1 },
              "sha256": { "type": "string", "pattern": "^[0-9a-f]{64}$" }
            }
          }
        }
      }
    },
    "reproducibility": {
      "type": "object",
      "additionalProperties": false,
      "required": ["hash_algorithm", "canonicalization", "hash"],
      "properties": {
        "hash_algorithm": { "type": "string", "const": "sha256" },
        "canonicalization": { "type": "string", "minLength": 1, "description": "How body is canonicalized before hashing, e.g. 'jq -S -c over .body'." },
        "hash": { "type": "string", "pattern": "^[0-9a-f]{64}$", "description": "SHA-256 over the canonical serialization of body." }
      }
    }
  }
}
