{
  "schema_version": "1",
  "metadata": {
    "generated_at": "2026-07-09T19:58:27Z",
    "generator": "generate-release-manifest.sh"
  },
  "body": {
    "action_pins": [
      {
        "source": ".github/workflows/ci-adopter-validation.yml",
        "uses": "actions/checkout@9c091bb21b7c1c1d1991bb908d89e4e9dddfe3e0"
      },
      {
        "source": ".github/workflows/ci-adopter-validation.yml",
        "uses": "actions/upload-artifact@043fb46d1a93c77aae656e7c1c64a875d1fc6a0a"
      },
      {
        "source": ".github/workflows/ci-codeql.yml",
        "uses": "actions/checkout@9c091bb21b7c1c1d1991bb908d89e4e9dddfe3e0"
      },
      {
        "source": ".github/workflows/ci-codeql.yml",
        "uses": "github/codeql-action/analyze@dd903d2e4f5405488e5ef1422510ee31c8b32357"
      },
      {
        "source": ".github/workflows/ci-codeql.yml",
        "uses": "github/codeql-action/autobuild@8aad20d150bbac5944a9f9d289da16a4b0d87c1e"
      },
      {
        "source": ".github/workflows/ci-codeql.yml",
        "uses": "github/codeql-action/init@dd903d2e4f5405488e5ef1422510ee31c8b32357"
      },
      {
        "source": ".github/workflows/ci-compatibility.yml",
        "uses": "actions/checkout@9c091bb21b7c1c1d1991bb908d89e4e9dddfe3e0"
      },
      {
        "source": ".github/workflows/ci-compatibility.yml",
        "uses": "actions/upload-artifact@043fb46d1a93c77aae656e7c1c64a875d1fc6a0a"
      },
      {
        "source": ".github/workflows/ci-docker.yml",
        "uses": "actions/checkout@9c091bb21b7c1c1d1991bb908d89e4e9dddfe3e0"
      },
      {
        "source": ".github/workflows/ci-docker.yml",
        "uses": "actions/upload-artifact@043fb46d1a93c77aae656e7c1c64a875d1fc6a0a"
      },
      {
        "source": ".github/workflows/ci-docker.yml",
        "uses": "aquasecurity/trivy-action@ed142fd0673e97e23eac54620cfb913e5ce36c25"
      },
      {
        "source": ".github/workflows/ci-node.yml",
        "uses": "actions/checkout@9c091bb21b7c1c1d1991bb908d89e4e9dddfe3e0"
      },
      {
        "source": ".github/workflows/ci-node.yml",
        "uses": "actions/setup-node@48b55a011bda9f5d6aeb4c2d9c7362e8dae4041e"
      },
      {
        "source": ".github/workflows/ci-node.yml",
        "uses": "actions/upload-artifact@043fb46d1a93c77aae656e7c1c64a875d1fc6a0a"
      },
      {
        "source": ".github/workflows/ci-php.yml",
        "uses": "actions/checkout@9c091bb21b7c1c1d1991bb908d89e4e9dddfe3e0"
      },
      {
        "source": ".github/workflows/ci-php.yml",
        "uses": "actions/upload-artifact@043fb46d1a93c77aae656e7c1c64a875d1fc6a0a"
      },
      {
        "source": ".github/workflows/ci-php.yml",
        "uses": "shivammathur/setup-php@f3e473d116dcccaddc5834248c87452386958240"
      },
      {
        "source": ".github/workflows/ci-pipeline.yml",
        "uses": "actions/checkout@9c091bb21b7c1c1d1991bb908d89e4e9dddfe3e0"
      },
      {
        "source": ".github/workflows/ci-pipeline.yml",
        "uses": "actions/download-artifact@3e5f45b2cfb9172054b4087a40e8e0b5a5461e7c"
      },
      {
        "source": ".github/workflows/ci-pipeline.yml",
        "uses": "actions/upload-artifact@043fb46d1a93c77aae656e7c1c64a875d1fc6a0a"
      },
      {
        "source": ".github/workflows/ci-pipeline.yml",
        "uses": "anchore/sbom-action@e22c389904149dbc22b58101806040fa8d37a610"
      },
      {
        "source": ".github/workflows/ci-pipeline.yml",
        "uses": "aquasecurity/trivy-action@ed142fd0673e97e23eac54620cfb913e5ce36c25"
      },
      {
        "source": ".github/workflows/ci-production-readiness.yml",
        "uses": "actions/checkout@9c091bb21b7c1c1d1991bb908d89e4e9dddfe3e0"
      },
      {
        "source": ".github/workflows/ci-production-readiness.yml",
        "uses": "actions/upload-artifact@043fb46d1a93c77aae656e7c1c64a875d1fc6a0a"
      },
      {
        "source": ".github/workflows/ci-production-readiness.yml",
        "uses": "zizmorcore/zizmor-action@192e21d79ab29983730a13d1382995c2307fbcaa"
      },
      {
        "source": ".github/workflows/ci-release-gate.yml",
        "uses": "actions/checkout@9c091bb21b7c1c1d1991bb908d89e4e9dddfe3e0"
      },
      {
        "source": ".github/workflows/ci-release-gate.yml",
        "uses": "actions/download-artifact@3e5f45b2cfb9172054b4087a40e8e0b5a5461e7c"
      },
      {
        "source": ".github/workflows/ci-release-gate.yml",
        "uses": "actions/upload-artifact@043fb46d1a93c77aae656e7c1c64a875d1fc6a0a"
      },
      {
        "source": ".github/workflows/ci-security.yml",
        "uses": "actions/checkout@9c091bb21b7c1c1d1991bb908d89e4e9dddfe3e0"
      },
      {
        "source": ".github/workflows/ci-security.yml",
        "uses": "actions/upload-artifact@043fb46d1a93c77aae656e7c1c64a875d1fc6a0a"
      },
      {
        "source": ".github/workflows/ci-security.yml",
        "uses": "anchore/sbom-action@e22c389904149dbc22b58101806040fa8d37a610"
      },
      {
        "source": ".github/workflows/ci-security.yml",
        "uses": "anchore/scan-action@e1165082ffb1fe366ebaf02d8526e7c4989ea9d2"
      },
      {
        "source": ".github/workflows/ci-security.yml",
        "uses": "aquasecurity/trivy-action@ed142fd0673e97e23eac54620cfb913e5ce36c25"
      },
      {
        "source": ".github/workflows/ci-security.yml",
        "uses": "gitleaks/gitleaks-action@ff98106e4c7b2bc287b24eaf42907196329070c7"
      },
      {
        "source": ".github/workflows/ci-security.yml",
        "uses": "google/osv-scanner-action/osv-scanner-action@9a498708959aeaef5ef730655706c5a1df1edbc2"
      },
      {
        "source": ".github/workflows/ci-self-test.yml",
        "uses": "actions/checkout@9c091bb21b7c1c1d1991bb908d89e4e9dddfe3e0"
      },
      {
        "source": ".github/workflows/ci-self-test.yml",
        "uses": "actions/upload-artifact@043fb46d1a93c77aae656e7c1c64a875d1fc6a0a"
      },
      {
        "source": ".github/workflows/ci-workflow-lint.yml",
        "uses": "actions/checkout@9c091bb21b7c1c1d1991bb908d89e4e9dddfe3e0"
      },
      {
        "source": ".github/workflows/ci-workflow-lint.yml",
        "uses": "zizmorcore/zizmor-action@192e21d79ab29983730a13d1382995c2307fbcaa"
      },
      {
        "source": ".github/workflows/ci-zap.yml",
        "uses": "actions/checkout@9c091bb21b7c1c1d1991bb908d89e4e9dddfe3e0"
      },
      {
        "source": ".github/workflows/ci-zap.yml",
        "uses": "zaproxy/action-baseline@66042c8e7e24680119199a017e5b0e8603bf4dae"
      },
      {
        "source": ".github/workflows/ci-zap.yml",
        "uses": "zaproxy/action-full-scan@d2a07475d467566c9a3e3c700f31f47724aa1060"
      },
      {
        "source": ".github/workflows/security-incident-validation.yml",
        "uses": "actions/checkout@9c091bb21b7c1c1d1991bb908d89e4e9dddfe3e0"
      },
      {
        "source": "templates/workflows/sentinel-shield-dast.yml",
        "uses": "actions/checkout@34e114876b0b11c390a56381ad16ebd13914f8d5"
      },
      {
        "source": "templates/workflows/sentinel-shield-dependency-check.yml",
        "uses": "actions/cache@0057852bfaa89a56745cba8c7296529d2fc39830"
      },
      {
        "source": "templates/workflows/sentinel-shield-dependency-check.yml",
        "uses": "actions/checkout@34e114876b0b11c390a56381ad16ebd13914f8d5"
      },
      {
        "source": "templates/workflows/sentinel-shield-main.yml",
        "uses": "actions/checkout@34e114876b0b11c390a56381ad16ebd13914f8d5"
      },
      {
        "source": "templates/workflows/sentinel-shield-pr-fast.yml",
        "uses": "actions/checkout@34e114876b0b11c390a56381ad16ebd13914f8d5"
      },
      {
        "source": "templates/workflows/sentinel-shield-scheduled.yml",
        "uses": "actions/cache@0057852bfaa89a56745cba8c7296529d2fc39830"
      },
      {
        "source": "templates/workflows/sentinel-shield-scheduled.yml",
        "uses": "actions/checkout@34e114876b0b11c390a56381ad16ebd13914f8d5"
      },
      {
        "source": "templates/workflows/sentinel-shield.yml",
        "uses": "actions/checkout@34e114876b0b11c390a56381ad16ebd13914f8d5"
      },
      {
        "source": "templates/workflows/sentinel-shield.yml",
        "uses": "actions/setup-node@49933ea5288caeca8642d1e84afbd3f7d6820020"
      },
      {
        "source": "templates/workflows/sentinel-shield.yml",
        "uses": "actions/upload-artifact@ea165f8d65b6e75b540449e92b4886f43607fa02"
      },
      {
        "source": "templates/workflows/sentinel-shield.yml",
        "uses": "anchore/sbom-action@e22c389904149dbc22b58101806040fa8d37a610"
      },
      {
        "source": "templates/workflows/sentinel-shield.yml",
        "uses": "aquasecurity/trivy-action@ed142fd0673e97e23eac54620cfb913e5ce36c25"
      },
      {
        "source": "templates/workflows/sentinel-shield.yml",
        "uses": "shivammathur/setup-php@f3e473d116dcccaddc5834248c87452386958240"
      }
    ],
    "artifact_digests": [
      {
        "artifact_id": 8208470506,
        "name": "sentinel-shield-adopter-validation",
        "run_id": 29042343550,
        "sha256": "47d366b06561358005e62bb71a17d1bfcff7a2bd4ef85bab2b64d7319a004c0a"
      },
      {
        "artifact_id": 8208472199,
        "name": "sentinel-shield-adopter-out",
        "run_id": 29042343552,
        "sha256": "23cb8483e07910d7182278826a488a2edf42f9326aa517f39523e2299436dc05"
      },
      {
        "artifact_id": 8208668254,
        "name": "sentinel-shield-production-readiness-report",
        "run_id": 29042343552,
        "sha256": "6ce3bb5f9a824b7026ce43116f22ebe11a30a0b3e660e5f7c92fa9a15640502a"
      },
      {
        "artifact_id": 8208473384,
        "name": "sentinel-shield-raw-security",
        "run_id": 29042343578,
        "sha256": "41ad16e3385f4d2dbcd33c55eb9e50b721d2712199306239e33381e8a43e066f"
      },
      {
        "artifact_id": 8208473916,
        "name": "sentinel-shield-security-summary",
        "run_id": 29042343578,